{
  "meta": {
    "url": "https://linear.app/",
    "title": "Linear – Plan and build products",
    "extractedAt": "2026-01-05T21:04:05.354Z",
    "viewport": { "width": 1251, "height": 1278 },
    "designCharacter": "Dark-mode-first SaaS product. Clean, minimal aesthetic with subtle gradients. Inter Variable as primary font with Berkeley Mono for code. Indigo accent color (#5e6ad2). Sophisticated easing curves and micro-animations. 4px/8px spacing grid."
  },
  "colors": {
    "cssVariables": {
      "--color-white": "#fff",
      "--color-black": "#000",
      "--color-blue": "#4ea7fc",
      "--color-red": "#eb5757",
      "--color-green": "#4cb782",
      "--color-orange": "#fc7840",
      "--color-yellow": "#f2c94c",
      "--color-indigo": "#5e6ad2",
      "--color-linear-plan": "#68cc58",
      "--color-linear-build": "#d4b144",
      "--color-linear-security": "#7a7fad",
      "--font-regular": "\"Inter Variable\",\"SF Pro Display\",-apple-system,BlinkMacSystemFont,\"Segoe UI\",\"Roboto\",\"Oxygen\",\"Ubuntu\",\"Cantarell\",\"Open Sans\",\"Helvetica Neue\",sans-serif",
      "--font-serif-display": "\"Tiempos Headline\",ui-serif,Georgia,Cambria,\"Times New Roman\",Times,serif",
      "--font-monospace": "\"Berkeley Mono\",ui-monospace,\"SF Mono\",\"Menlo\",monospace",
      "--font-weight-light": "300",
      "--font-weight-normal": "400",
      "--font-weight-medium": "510",
      "--font-weight-semibold": "590",
      "--font-weight-bold": "680",
      "--radius-4": "4px",
      "--radius-6": "6px",
      "--radius-8": "8px",
      "--radius-12": "12px",
      "--radius-16": "16px",
      "--radius-24": "24px",
      "--radius-32": "32px",
      "--radius-rounded": "9999px",
      "--speed-quickTransition": ".1s",
      "--speed-regularTransition": ".25s",
      "--ease-out-quad": "cubic-bezier(.25,.46,.45,.94)",
      "--ease-out-cubic": "cubic-bezier(.215,.61,.355,1)",
      "--ease-out-quart": "cubic-bezier(.165,.84,.44,1)",
      "--ease-out-quint": "cubic-bezier(.23,1,.32,1)",
      "--ease-out-expo": "cubic-bezier(.19,1,.22,1)",
      "--page-padding-inline": "24px",
      "--page-max-width": "1024px",
      "--prose-max-width": "624px"
    },
    "palette": [
      { "value": "#f7f8f8", "count": 4965, "role": "text-primary" },
      { "value": "#8a8f98", "count": 323, "role": "text-secondary" },
      { "value": "#d0d6e0", "count": 88, "role": "text-tertiary" },
      { "value": "#62666d", "count": 68, "role": "text-muted" },
      { "value": "#ffffff", "count": 52, "role": "white" },
      { "value": "#0f1011", "count": 15, "role": "background-primary" },
      { "value": "#08090a", "count": 11, "role": "background-elevated" },
      { "value": "#68cc58", "count": 11, "role": "success" },
      { "value": "#5e6ad2", "count": 3, "role": "accent-indigo" },
      { "value": "#28282c", "count": 12, "role": "surface" },
      { "value": "#1c1c1f", "count": 12, "role": "surface-subtle" },
      { "value": "#3e3e44", "count": 13, "role": "border" }
    ],
    "semantic": {
      "backgrounds": [
        { "value": "#0f1011", "count": 8 },
        { "value": "#ffffff", "count": 8 },
        { "value": "#08090a", "count": 4 },
        { "value": "#28282c", "count": 6 },
        { "value": "#1c1c1f", "count": 5 },
        { "value": "#18191a", "count": 5 },
        { "value": "#141516", "count": 4 }
      ],
      "text": [
        { "value": "#f7f8f8", "count": 2495 },
        { "value": "#8a8f98", "count": 165 },
        { "value": "#d0d6e0", "count": 44 },
        { "value": "#62666d", "count": 35 },
        { "value": "#ffffff", "count": 19 },
        { "value": "#68cc58", "count": 4 }
      ],
      "borders": [
        { "value": "#f7f8f8", "count": 2470 },
        { "value": "#8a8f98", "count": 156 },
        { "value": "#3e3e44", "count": 13 },
        { "value": "#1c1c1f", "count": 7 }
      ],
      "accents": [
        { "value": "#5e6ad2", "count": 3 },
        { "value": "#68cc58", "count": 3 },
        { "value": "#28282c", "count": 6 }
      ]
    }
  },
  "typography": {
    "fontFamilies": [
      { "family": "Inter Variable", "weight": "100 900", "style": "normal", "role": "primary-sans" },
      { "family": "Berkeley Mono", "weight": "100 900", "style": "normal", "role": "monospace" }
    ],
    "scale": ["10px", "12px", "13px", "14px", "15px", "16px", "17px", "21px", "24px", "40px", "56px", "64px"],
    "fontWeights": ["400", "510", "538", "590", "680"],
    "lineHeights": [
      { "value": "24px", "count": 2264 },
      { "value": "19.5px", "count": 150 },
      { "value": "normal", "count": 126 },
      { "value": "21px", "count": 52 },
      { "value": "40px", "count": 51 }
    ],
    "letterSpacing": [
      { "value": "-0.13px", "count": 138 },
      { "value": "-0.182px", "count": 49 },
      { "value": "-0.165px", "count": 34 },
      { "value": "-1.408px", "count": 24, "note": "display-tight" }
    ]
  },
  "spacing": {
    "scale": ["4px", "6px", "8px", "10px", "12px", "16px", "20px", "24px", "32px", "40px", "48px", "56px", "64px", "72px", "96px", "160px"],
    "grid": "4px",
    "gaps": [
      { "value": "8px", "count": 48 },
      { "value": "6px", "count": 47 },
      { "value": "4px", "count": 22 },
      { "value": "12px", "count": 15 },
      { "value": "16px", "count": 14 },
      { "value": "32px", "count": 12 },
      { "value": "24px", "count": 11 }
    ],
    "paddings": [
      { "value": "24px", "count": 80 },
      { "value": "16px", "count": 65 },
      { "value": "4px", "count": 35 },
      { "value": "12px", "count": 34 },
      { "value": "32px", "count": 22 },
      { "value": "8px", "count": 21 }
    ]
  },
  "animations": {
    "keyframes": {
      "fadeIn": "0%: opacity 0 → 100%: opacity 1",
      "fadeOut": "0%: opacity 1 → 100%: opacity 0",
      "scaleIn": "0%: scale(0.95), opacity 0 → 100%: scale(1), opacity 1",
      "scaleOut": "0%: scale(1), opacity 1 → 100%: scale(0.95), opacity 0",
      "slideDown": "0%: height 0, translateY(-8px) → 100%: height var(--radix-collapsible-content-height)",
      "blurIn": "0%: blur(4px), opacity 0 → 100%: none, opacity 1",
      "blurOut": "0%: none, opacity 1 → 100%: blur(4px), opacity 0"
    },
    "transitions": [
      { "value": "all", "count": 2689 },
      { "value": "color 0.1s", "count": 34 },
      { "value": "border 0.16s cubic-bezier(0.25, 0.46, 0.45, 0.94)", "count": 26 }
    ],
    "durations": ["0.1s", "0.16s", "0.2s", "0.24s", "0.25s", "0.32s"],
    "easings": [
      "cubic-bezier(0.25, 0.46, 0.45, 0.94)",
      "cubic-bezier(0.215, 0.61, 0.355, 1)",
      "cubic-bezier(0.165, 0.84, 0.44, 1)",
      "ease-out"
    ]
  },
  "components": {
    "buttons": [
      {
        "variant": "secondary",
        "backgroundColor": "#181a1a",
        "textColor": "#f7f8f8",
        "borderRadius": "5px",
        "padding": "0px 12px",
        "fontSize": "12px",
        "fontWeight": "510",
        "border": "0.666667px solid rgb(38, 39, 40)"
      },
      {
        "variant": "circle",
        "backgroundColor": "#28282c",
        "textColor": "#f7f8f8",
        "borderRadius": "9999px",
        "padding": "0px 16px",
        "fontSize": "15px",
        "fontWeight": "510",
        "border": "0.666667px solid rgb(62, 62, 68)"
      },
      {
        "variant": "card",
        "backgroundColor": "#0f1011",
        "textColor": "#f7f8f8",
        "borderRadius": "16px",
        "padding": "32px 24px",
        "fontSize": "16px",
        "fontWeight": "400"
      }
    ],
    "inputs": [
      {
        "type": "text",
        "backgroundColor": "transparent",
        "borderColor": "#ffffff",
        "borderRadius": "0px",
        "padding": "0px 20px",
        "fontSize": "17px"
      }
    ]
  },
  "shadows": [
    { "value": "rgba(0, 0, 0, 0) 0px 8px 2px 0px, rgba(0, 0, 0, 0.01) 0px 5px 2px 0px, rgba(0, 0, 0, 0.04) 0px 3px 2px 0px, rgba(0, 0, 0, 0.07) 0px 1px 1px 0px, rgba(0, 0, 0, 0.08) 0px 0px 1px 0px", "count": 7, "role": "elevation-low" },
    { "value": "rgba(0, 0, 0, 0.2) 0px 4px 24px 0px", "count": 1, "role": "elevation-medium" },
    { "value": "rgba(0, 0, 0, 0.35) 0px 7px 32px 0px", "count": 1, "role": "elevation-high" }
  ],
  "borderRadius": [
    { "value": "4px", "count": 12, "role": "small" },
    { "value": "6px", "count": 11, "role": "default" },
    { "value": "8px", "count": 18, "role": "medium" },
    { "value": "10px", "count": 13 },
    { "value": "16px", "count": 10, "role": "large" },
    { "value": "9999px", "count": 32, "role": "pill" },
    { "value": "50%", "count": 37, "role": "circle" }
  ],
  "breakpoints": {
    "detected": [600, 640, 768, 1024, 1280, 1400, 1536],
    "containerWidths": [360, 400, 720, 900, 1024, 1171, 1600]
  },
  "icons": {
    "library": null,
    "note": "Custom SVG icons"
  }
}
